{
  "dataset_kind": "diagnostic",
  "generation_id": "D1A6000000000001",
  "items": [
    {
      "class_name": null,
      "entry_kind": "value",
      "expanded": true,
      "key": "/capabilities",
      "label": "capabilities",
      "links": [],
      "metadata_json": "{}",
      "native_type": null,
      "native_unit": null,
      "node_id": null,
      "origin": null,
      "status": null,
      "unit_evidence": null,
      "value_count": 3,
      "value_json": "{\n    \"inventory\": [\n      {\n        \"node_id\": \"root/properties/components/0/properties/Attributes\",\n        \"facts\": {\n          \"weight\": {\n            \"source\": {\n              \"property\": \"Weight\"\n            }\n          }\n        }\n      }\n    ],\n    \"storage\": [\n      {\n        \"node_id\": \"root/properties/components/0\",\n        \"facts\": {\n          \"capacity_coefficient\": {\n            \"source\": {\n              \"property\": \"CapacityCoefficient\"\n            }\n          },\n          \"max_cumulative_volume\": {\n            \"source\": {\n              \"property\": \"MaxCumulativeVolume\"\n            }\n          }\n        }\n      }\n    ],\n    \"visuals\": [\n      {\n        \"node_id\": \"root/properties/components/1\",\n        \"facts\": {\n          \"model\": {\n            \"source\": {\n              \"property\": \"Object\"\n            }\n          }\n        }\n      }\n    ]\n  }",
      "value_kind": "object",
      "view": null
    },
    {
      "class_name": null,
      "entry_kind": "value",
      "expanded": true,
      "key": "/names",
      "label": "names",
      "links": [],
      "metadata_json": "{}",
      "native_type": null,
      "native_unit": null,
      "node_id": null,
      "origin": null,
      "status": null,
      "unit_evidence": null,
      "value_count": 1,
      "value_json": "[\n    {\n      \"node_id\": \"root/properties/components/0/properties/Attributes/properties/ItemDisplayName\",\n      \"display_name_en\": {\n        \"status\": \"present\",\n        \"value\": \"Fixture Field Pack\"\n      }\n    }\n  ]",
      "value_kind": "array",
      "view": null
    },
    {
      "class_name": null,
      "entry_kind": "value",
      "expanded": true,
      "key": "/references",
      "label": "references",
      "links": [],
      "metadata_json": "{}",
      "native_type": null,
      "native_unit": null,
      "node_id": null,
      "origin": null,
      "status": null,
      "unit_evidence": null,
      "value_count": 3,
      "value_json": "[\n    {\n      \"node_id\": \"root/properties/components/0\",\n      \"property\": \"Pouch\",\n      \"resource_name\": \"{2222222222222222}Prefabs/Items/Equipment/Pouches/Pouch_Fixture.et\",\n      \"kind\": \"gameplay\",\n      \"method\": \"BaseContainer.Get\"\n    },\n    {\n      \"node_id\": \"root/properties/components/1\",\n      \"property\": \"Object\",\n      \"resource_name\": \"{5555555555555555}Assets/Items/Equipment/Backpacks/Backpack_Fixture.xob\",\n      \"kind\": \"binary\",\n      \"method\": \"BaseContainer.Get\"\n    },\n    {\n      \"node_id\": \"root/properties/components/1/ancestor\",\n      \"property\": \"Object\",\n      \"resource_name\": \"{A4048C2AA75EF832}Common/Models/Default.xob\",\n      \"kind\": \"binary\",\n      \"method\": \"BaseContainer.Get\"\n    }\n  ]",
      "value_kind": "array",
      "view": null
    },
    {
      "class_name": null,
      "entry_kind": "value",
      "expanded": true,
      "key": "/resource_id",
      "label": "resource_id",
      "links": [],
      "metadata_json": "{}",
      "native_type": null,
      "native_unit": null,
      "node_id": null,
      "origin": null,
      "status": null,
      "unit_evidence": null,
      "value_count": 21,
      "value_json": "\"guid:1111111111111111\"",
      "value_kind": "string",
      "view": null
    },
    {
      "class_name": null,
      "entry_kind": "value",
      "expanded": true,
      "key": "/resource_name",
      "label": "resource_name",
      "links": [],
      "metadata_json": "{}",
      "native_type": null,
      "native_unit": null,
      "node_id": null,
      "origin": null,
      "status": null,
      "unit_evidence": null,
      "value_count": 71,
      "value_json": "\"{1111111111111111}Prefabs/Items/Equipment/Backpacks/Backpack_Fixture.et\"",
      "value_kind": "string",
      "view": null
    },
    {
      "class_name": null,
      "entry_kind": "value",
      "expanded": true,
      "key": "/source_addons",
      "label": "source_addons",
      "links": [],
      "metadata_json": "{}",
      "native_type": null,
      "native_unit": null,
      "node_id": null,
      "origin": null,
      "status": null,
      "unit_evidence": null,
      "value_count": 1,
      "value_json": "[\n    \"ArmaReforger\"\n  ]",
      "value_kind": "array",
      "view": null
    }
  ],
  "next_cursor": null,
  "node_id": null,
  "node_metadata_json": "{}",
  "resource_id": "guid:1111111111111111",
  "total": 6
}
